111,OPPO Reno14 5G 12GB 256GB,15.200.000đ,/dien-thoai/oppo-reno14,Trung Quốc,06/2025,24 tháng,157.9 x 74.73 x 7.42 mm,187 g,Khung máy: Hợp kim nhômMặt lưng máy: Kính,Dimensity 8350,Octa-Core,8,3.35 GHz,12 GB,6.59 inch,AMOLED,1.5K,1256 x 2760 Pixels,120 Hz,Điện dung đa điểm,,Mali-G615 MC6,256 GB,Không giới hạn,,,Standard,8.0 MP,50.0 MP,,,,1,2 Nano SIM,5G,Cổng sạc: Type C,Dual-band (2.4 GHz/ 5 GHz)Wifi 6802.11 a/b/g/n/ac/ax,GPSGLONASSBDSGALILEOQZSS,v5.4,OTGNFC,Lithium polymer,6000 mAh,SuperVOOC 45W,Android,Android 15 (ColorOS 15),Cáp USB Type CCủ sạcSách HDSDQue lấy SIM,"IP66, IP68, IP69",,,460 ppi,,,,,,,,,Triple rear camera,ƒ/2.0,Tele Leica,Single selfie camera,,1 Tỷ,"Để nơi khô ráo, nhẹ tay, dễ vỡ.",Xem trong sách hướng dẫn sử dụng,,Ultra Wide,,,,,,,,,,,IMX882,,
112,OPPO A5i 4GB 64GB,3.290.000đ,/dien-thoai/oppo-a5i,Trung Quốc,09/2025,12 tháng,165.7 x 76 x 7.68 mm,186 g,Mặt lưng máy: Thủy tinh hữu cơKhung viền: Nhựa,Snapdragon 6s 4G Gen1,Octa-Core,8,2.1 GHz,4 GB,6.67 inch,LCD,HD+,720 x 1604 Pixels,90 Hz,,1000 nits,Adreno 610,64 GB,,,1 TB,,8.0 MP,5.0 MP,Cảm biến tiệm cậnCảm biến ánh sángCảm biến gia tốcCảm biến la bàn,Mở khoá vân tay cạnh viền,,2,"1 Nano Sim, 1 Thẻ nhớ",4G,Cổng sạc: Type C,Dual-band (2.4 GHz/ 5 GHz)802.11 a/b/g/n/ac,BEIDOUGALILEOGLONASSGPSQZSS,v5.0,OTG,Lithium polymer,5100 mAh,SuperVOOC 45W,Android,Android 14 (ColorOS 14),Que lấy SIMDây cáp sạcCủ sạcSách HDSDVỏ bảo vệMiếng dán màn hình (Đã dán sẵn),IPX4,,,264 ppi,,,,,,Kính cường lực Panda,,,Single rear camera,ƒ/2.2,,Single selfie camera,,16 Triệu,"Để nơi khô ráo, nhẹ tay, dễ vỡ.",Xem trong sách hướng dẫn sử dụng,,,,,,,,,,,,,,,
113,OPPO Reno12 F 5G 8GB 256GB,6.990.000đ,/dien-thoai/oppo-reno12-f,Trung Quốc,06/2024,12 tháng,163.05 x 75.75 x 7.76 mm,187 g,Khung máy: Nhựa cao cấpMặt lưng máy: Kính cường lực,Dimensity 6300 5G,Octa-Core,8,2.4 GHz,8 GB,6.67 inch,AMOLED,FHD+,1080 x 2040 Pixel,120 Hz,Điện dung đa điểm,1200 nits,Mali-G57 MC2,256 GB,Không giới hạn,MicroSD,2 TB,Standard,2.0 MP,32.0 MP,Cảm biến vân tayCảm biến tiệm cậnCảm biến ánh sángCảm biến gia tốcCảm biến la bàn,Mở khóa bằng mật mãMở khóa vân tayMật khẩuMở khóa khuôn mặt,Đèn Viền CameraNhiếp Ảnh Thời Thượng AICảm ứng kháng nước,2,2 Nano SIM,5G,Cổng sạc: Type C,Wifi 6,GPSGLONASSBDSGALILEOQZSS,v5.3,NFCOTG,Lithium polymer,5000 mAh,SuperVOOC 45W,Android,Android 14 (ColorOS 14.1),Cáp USB Type CCủ sạcỐp lưngSách HDSDQue lấy SIM,IP64,,,,,4K 2160p@30fps1080p@60fps1080p@30fps720p@30fps,Tự động lấy nét (AF)Trôi nhanh thời gian (Time lapse),4K 2160p@30fps1080p@30fps720p@30fps,,Kính cường lực AGC DT-Star2,,,,ƒ/2.4,Wide,,,16 Triệu,,,,Macro lens,,,,,,,,,,,,,
114,Tecno Camon 40 Pro 8GB 256GB,5.570.000đ,/dien-thoai/tecno-camon-40-pro,Trung Quốc,04/2025,13 tháng,"164,44 x 74,32 x 7,31mm",178 g,Khung máy: NhựaMặt lưng máy: Nhựa,MediaTek Helio G100,,8,,8 GB,6.78 inch,AMOLED,FHD+,1080 x 2436 Pixels,120 Hz,Điện dung đa điểm,,Mali-G57 MC2,256 GB,,MicroSD,1 TB,Wide,8.0 MP,32.0 MP,Cảm biến địa từCảm biến ánh sángHồng ngoạiCảm biến la bàn,Mở khóa vân tay,,2,2 Nano SIM,4G,Type C,Dual-band (2.4 GHz/ 5 GHz),,v5.4,NFCOTG,Lithium polymer,5200 mAh,Sạc nhanh 45 W,Android,Android 15,,"IP68, IP69",90%,4 x Cortex A78 2.5 GHz + 4 x Cortex A55 2.5 GHz,,Khoảng 230 GB,1080p@30fps1080p@60fps,Góc Siêu RộngCảm biến AI SnapshotCamera Siêu ĐêmTự động lấy nét (AF),,,,,,,ƒ/1.9,Ultra Wide,,,,,,,,,,,,,,,,,,,,
115,Tecno Camon 40 8GB 128GB,4.990.000đ,/dien-thoai/tecno-camon-40,Trung Quốc,04/2025,13 tháng,"163,91 x 74,63 x 7,34mm",177 g,Khung máy: NhựaMặt lưng máy: Nhựa,MediaTek Helio G100,,8,,8 GB,6.78 inch,AMOLED,FHD+,1080 x 2436 Pixels,120 Hz,Điện dung đa điểm,,Mali-G57 MC2,128 GB,,MicroSD,1 TB,Wide,8.0 MP,32.0 MP,Cảm biến địa từCảm biến ánh sángHồng ngoạiCảm biến la bàn,Mở khóa vân tay,,2,2 Nano SIM,4G,Type C,Dual-band (2.4 GHz/ 5 GHz),,v5.2,NFCOTG,Lithium polymer,5200 mAh,Sạc nhanh 45 W,Android,Android 15,Dây cáp sạcDock sạcỐp lưng,IP66,90%,2 x Cortex-A76 2.20 GHz + 6 x Cortex-A55 2.00 GHz,,Khoảng 115 GB,1080p@30fps1080p@60fps,Góc Siêu RộngCảm biến AI SnapshotCamera Siêu ĐêmTự động lấy nét (AF),,,,,,,ƒ/1.9,Ultra Wide,,,,,,,,,,,,,,,,,,,,
116,Samsung Galaxy Z Flip7 5G 12GB 256GB,23.690.000đ,/dien-thoai/samsung-galaxy-z-flip7,Việt Nam / Trung Quốc,07/2025,12 tháng,166.7 x 75.2 x 6.5 mm,188 g,Khung máy: Armor aluminum,Exynos 2500,,8,,12 GB,6.9 inch,Màn hình chính: Dynamic AMOLED 2X,FHD+,2520 x 1080 Pixels,120 Hz,,2600 nits,Adreno750,256 GB,Không giới hạn,,,Ống kính góc rộng,12.0 MP,10.0 MP,,Mở khóa vân tayMẫu hìnhPINMật khẩuMở khóa khuôn mặt,Gemini LiveNow BriefNow BarHỗ trợ viếtHỗ trợ cuộc gọiThực hiện liên tác vụ bằng giọng nóiGoogle GeminiKhoanh tròn tìm kiếm,1,"1 eSIM, 1 Nano SIM",2G3G4G5G,Cổng sạc: Type C,802.11 a/b/g/n,BEIDOUQZSSGPSGLONASSGALILEO,v5.3,NFC,Đang cập nhật,4300 mAh,,Android,Android 16,Que lấy SIMCáp Type CSách HDSD,IPX8,,,,,UHD 4K (3840 x 2160)@30fpsHD 240fps,Chọn ảnh chân dung đẹp nhất (Best Face)Lọc âm thanh (Audio Eraser),,,Corning Gorilla Glass Victus 2,,,Double rear camera,,Ống kính góc siêu rộng,Single selfie camera,,16 Triệu,"Để nơi khô ráo, nhẹ tay, dễ vỡ.",Xem trong sách hướng dẫn sử dụng,,,,,,,,,,,,,,,
117,Tecno Spark Go 2 4GB 64GB,2.390.000đ,/dien-thoai/tecno-spark-go-2,Trung Quốc,09/2025,13 tháng,165.66 x 77 x 8.25 mm,188 g,Khung máy: NhựaMặt lưng máy: Nhựa,Unisoc T7250,Octa-Core,8,8 GHz,4 GB,6.67 inch,LCD,HD+,720 x 1600 Pixels,120 Hz,Điện dung đa điểm,720 nits,Mali-G52,64 GB,,MicroSD,1 TB,,13.0 MP,8.0 MP,Cảm biến gia tốcCảm biến tiệm cậnCảm biến ánh sáng,Mở khoá vân tay cạnh viền,,2,2 Nano SIM,4G,Cổng sạc: Type C,802.11 a/b/g/n/ac,,v5.2,OTG,Lithium polymer,5000 mAh,Sạc nhanh 15 W,Android,Android 15,Dây cáp sạcCủ sạcỐp lưng,IP64,84%,2 x Cortex A75 1.8 GHz + 6 x Cortex A55 1.6 GHz,264 ppi,,1080p@30fps,LED flash,,,,,,,,,,,,,,,,,,,,,,,,,,,,
118,RedMagic 11 Pro 5G 16GB 512GB,23.490.000đ,/dien-thoai/redmagic-11-pro-16gb,Trung Quốc,11/2025,12 tháng,163.8 x 76.5 x 8.9 mm,230 g,Khung viền: NhômMặt lưng máy: Kính,Snapdragon 8 Elite Gen 5,Octa-Core,8,4.6 GHz,16 GB,6.85 inch,AMOLED,FHD+,1216 x 2688 Pixels,144,Điện dung đa điểm,1800 nits,Adreno 840,512 GB,Không giới hạn,Không,,Wide,50.0 MP,16.0 MP,Cảm biến la bànCảm biến gia tốcCảm biến tiệm cậnCảm biến vân tayCon quay hồi chuyển,Mật khẩuMở khóa vân tay dưới màn hình,LED RGBSạc không dây 80W,2,2 Nano SIM,5G,Cổng sạc: Type C,Wifi 7,GPSGALILEOGLONASSBDS,v5.4,NFCOTGHồng ngoạiDisplayPort,Silicon carbon,7500 mAh,Sạc nhanh 80 W,Android,Android 16,SạcCápỐp lưngQue lấy SIMSách HDSD,IPX8,,2 x 4.6 GHz Oryon V3 Phoenix L + 6 x 3.62 GHz Oryon V3 Phoenix M,431 ppi,,8K@24/30fps4K@30fps1080p@30/60fps1080p@240fps,HDR,1080p@30/60fps,,Corning Gorilla Glass,,,,ƒ/2.0,Ultra Wide,,Hỗ trợ sạc không dây,1 Tỷ,,,,Ống kính phụ trợ,,,1.12 µm,,,,,,,,,Có,0.61 µm
119,OPPO Reno13 F 8GB 256GB,7.990.000đ,/dien-thoai/oppo-reno13-f,Trung Quốc,01/2025,24 tháng,162.2 x 75.05 x 7.76 mm,192 g,Khung máy: Nhựa cao cấpMặt lưng máy: Thủy tinh hữu cơ,MediaTek Helio G100,Octa-Core,8,2.2 GHz,8 GB,6.67 inch,AMOLED,FHD,1080 x 2040 Pixel,120 Hz,Điện dung đa điểm,1200 nits,ARM Mali G57,256 GB,Không giới hạn,MicroSD,1 TB,Standard,2.0 MP,32.0 MP,Cảm biến vân tay (dưới màn hình)Cảm biến tiệm cậnCảm biến ánh sángCảm biến gia tốcCảm biến la bàn,Mở khóa bằng mật mãMở khóa vân tayMở khóa khuôn mặt,Chế độ chụp ảnh dưới nướcTính năng AI,2,2 Nano SIM,4G,Cổng sạc: Type C,Dual-band (2.4 GHz/ 5 GHz)802.11 a/b/g/n/ac,GPSGLONASSBDSGALILEOQZSS,v5.3 BLE,OTGNFC,Lithium polymer,5800 mAh,SuperVOOC 45W,Android,Android 15 (ColorOS 15),Cáp USB Type CCủ sạcỐp lưngSách HDSDQue lấy SIM,"IP66, IP68, IP69",,,,,4K 2160p@30fps1080p@60fps1080p@30fps720p@30fps,Tự động lấy nét (AF)Trôi nhanh thời gian (Time lapse),4K 2160p@30fps1080p@30fps720p@30fps,,Kính cường lực AGC DT-Star2,,,,ƒ/2.4,Wide,,Sạc siêu nhanh SuperVOOC,16 Triệu,,,,Macro lens,,,,,,,,,,,,,
120,Xiaomi Poco C71 4GB 128GB,2.650.000đ,/dien-thoai/xiaomi-poco-c71,Trung Quốc,2025,18 tháng,171.8 x 77.8 x 8.3 mm,193 g,Khung máy: NhựaMặt lưng máy: Nhựa cao cấp,Unisoc T7250 (T615),Octa-Core,8,1.8 GHz,4 GB,6.88 inch,IPS LCD,HD+,1640 x 720 Pixels,120 Hz,,450 nits,Mali-G57,128 GB,,MicroSD,,Wide,32.0 MP,8.0 MP,Cảm biến tiệm cậnCảm biến la bànCảm biến ánh sángCảm biến gia tốc kế,Mở khóa khuôn mặtMở khoá vân tay cạnh viền,,2,"2 Nano SIM hoặc 1 eSIM, 1 Nano SIM",4G,Cổng sạc: Type C,802.11 a/b/g/n/acDual-band (2.4 GHz/ 5 GHz),GPSGLONASSGALILEOBDS,v5.2,OTG,Lithium polymer,5200 mAh,Sạc nhanh 15 W,Android,Android 15,Củ sạcCáp USB Type CQue lấy SIMỐp lưngSách HDSD,,,,260 ppi,,1080p@30fps720p@30fps,Chế độ chân dungHDRTrôi nhanh thời gian (Time lapse)Ban đêm (Night Mode),720p@30fps1080p@30fps,LPDDR4X,,70% NTSC,1500:1,Single rear camera,ƒ/2.0,,Single selfie camera,Sạc pin nhanh,,"Để nơi khô ráo, nhẹ tay, dễ vỡ.",Xem trong sách hướng dẫn sử dụng,,,,,,,,,,,,,,,
121,Samsung Galaxy S24 FE 5G 128GB,12.490.000đ,/dien-thoai/samsung-galaxy-s24-fe,Việt Nam / Trung Quốc,09/2024,12 tháng,16.2 x 7.73 x 8 cm,213 g,Mặt lưng máy: Gorilla Glass Victus+Viền máy: Kim loại,Exynos 2400,Octa-Core,8,,8 GB,6.7 inch,Dynamic AMOLED 2X,FHD+,1080 x 2340 Pixels,,,,Xclipse 940,128 GB,Không giới hạn,Không,,,8.0 MP,10.0 MP,,Mở khóa vân tay dưới màn hìnhMở khóa khuôn mặt,Sạc nhanh 25 WSạc không dâySạc ngược không dâyKhoanh Vùng Search Đa năngTrợ lý Chat thông minhTrợ lý Chỉnh ảnhPhiên dịch Trực tiếpSamsung DeXTrợ lý ảo Samsung BixbyGhi âm cuộc gọiMàn hình luôn hiển thịChặn tin nhắnChặn cuộc gọiSamsung WalletThu nhỏ màn hình sử dụng một tayAKG Dolby,1,"1 eSIM, 1 Nano SIM",5G,Type C,802.11 a/b/g/n/acDual-band (2.4 GHz/ 5 GHz)Wi-Fi HotspotWi-Fi DirectMIMO,GPSGLONASSGALILEOBEIDOUQZSS,v5.3,NFC,Lithium-ion,4700 mAh,,Android,Android 14,Sách HDSDCápQue lấy SIM,IP68,,,,,UHD 8K (7680 x 4320)@30fps,Làm đẹp (Beautify),,,,,,Triple rear camera,,,,,16 Triệu,"Để nơi khô ráo, nhẹ tay, dễ vỡ.",Xem trong sách hướng dẫn sử dụng,,,,,,,,,,,,,,,
122,Nubia A36 4GB 64GB,2.490.000đ,/dien-thoai/nubia-a36,Trung Quốc,05/2025,18 tháng,167.64 x 77.37 x 8.3 mm,400 g,Khung viền: NhựaMặt lưng máy: Nhựa,T7200,Octa-Core,8,1.6 GHz,4 GB,6.75 inch,IPS LCD,HD+,720 x 1600 Pixels,90 Hz,Điện dung đa điểm,,ARM Mali G57,64 GB,Không giới hạn,MicroSD,1 TB,Standard,0.08 MP,5.0 MP,Cảm biến la bànCảm biến gia tốcCảm biến tiệm cận,Mật khẩuMở khóa khuôn mặt,,2,2 Nano SIM,4G,Cổng sạc: Type C,802.11 a/b/g/n/ac,GPSA-GPSGALILEOGLONASS,v5.2,,Lithium polymer,5000 mAh,Sạc 10 W,Android,Android 15,SạcCápỐp lưngQue lấy SIMSách HDSD,,,,,,,,,,,,,,,,,,,,,,,,,,,,,,,,,,,
123,Xiaomi Redmi Note 14 5G 8GB 256GB,6.490.000đ,/dien-thoai/xiaomi-redmi-note-14-5g,Trung Quốc,03/2025,18 tháng,162.4 x 75.7 x 7.99 mm,190 g,Mặt lưng máy: Nhựa cao cấpKhung máy: Nhựa,MediaTek Dimensity 7025-Ultra,Octa-Core,8,2.5 GHz,8 GB,6.67 inch,AMOLED,FHD+,1080 x 2400 Pixels,120 Hz,,2100 nits,IMG BXM-8-256,256 GB,,MicroSD,1 TB,Wide,2.0 MP,20.0 MP,Cảm biến vân tayCảm biến gia tốcCảm biến la bànCon quay hồi chuyển,Mở khóa vân tay dưới màn hìnhMở khóa khuôn mặt,Google GeminiXóa AIAI SkyLàm đẹp AI,2,2 Nano SIM,5G,Cổng sạc: Type C,,GPSGLONASSBDSGALILEO,v5.3,NFC,Lithium polymer,5110 mAh,Sạc nhanh 45 W,Android,Android 14 (Hyper OS),Que lấy SIMSách HDSDDây cáp sạcSạcỐp lưng,IP64,,,,,1080p@30fps,Chống rung quang học (OIS)Chống rung điện tử (EIS)HDRToàn cảnh (Panorama)Flash LED,1080p@30fps,LPDDR4X,Gorilla Glass 5,100% DCI-P3,5.000.000 : 1,Triple rear camera,ƒ/2.2,Ultra Wide,Single selfie camera,Sạc pin nhanh,,,,,Macro lens,,,,,,,,,,,,,
124,OPPO Reno13 F 5G 12GB 256GB,9.990.000đ,/dien-thoai/oppo-reno13-f-5g,Trung Quốc,01/2025,24 tháng,162.2 x 75.05 x 7.76 mm,192 g,Khung máy: Nhựa cao cấpMặt lưng máy: Thủy tinh hữu cơ,Qualcomm Snapdragon 6 Gen1,Octa-Core,8,2.2 GHz,12 GB,6.67 inch,AMOLED,FHD,1080 x 2040 Pixel,120 Hz,Điện dung đa điểm,1200 nits,Adreno 710,256 GB,Không giới hạn,MicroSD,2 TB,Standard,2.0 MP,32.0 MP,Cảm biến vân tay (dưới màn hình)Cảm biến tiệm cậnCảm biến ánh sángCảm biến gia tốcCảm biến la bàn,Mở khóa bằng mật mãMở khóa vân tayMở khóa khuôn mặt,Chế độ chụp ảnh dưới nướcTính năng AI,2,2 Nano SIM,5G,Cổng sạc: Type C,Dual-band (2.4 GHz/ 5 GHz)802.11 a/b/g/n/ac,GPSGLONASSBDSGALILEOQZSS,v5.1,OTGNFC,Lithium polymer,5800 mAh,SuperVOOC 45W,Android,Android 15 (ColorOS 15),Cáp USB Type CCủ sạcỐp lưngSách HDSDQue lấy SIM,"IP66, IP68, IP69",,,,,4K 2160p@30fps1080p@60fps1080p@30fps720p@30fps,Tự động lấy nét (AF)Trôi nhanh thời gian (Time lapse),4K 2160p@30fps1080p@30fps720p@30fps,,Kính cường lực AGC DT-Star2,,,,ƒ/2.4,Wide,,Sạc siêu nhanh SuperVOOC,16 Triệu,,,,Macro lens,,,,,,,,,,,,,
125,Inoi 240 Modern 4G,349.000đ,/dien-thoai/inoi-240-modern-4g,Trung Quốc,09/2024,26 tháng,114.6 x 48 x 14.5 mm,76 g,Mặt lưng máy: Nhựa,,,,,,1.8 inch,TFT LCD,QQVGA,128 x 160 Pixels,,,,,128 MB,,MicroSD,64 GB,,,,,,Ghi âm cuộc gọi,2,2 Nano SIM,4G,,,,v5.0,Jack 3.5 mm,,1000 mAh,,,,Pin rờiSạcSách HDSD,,,,,,,,,,,,,Single rear camera,,,,,,,,,,,,,,,,,,,,,,
126,OPPO A58 8GB 128GB,4.390.000đ,/dien-thoai/oppo-a58-8gb,Trung Quốc,07/2024,12 tháng,165.65 x 75.98 x 7.99 mm,192 g,Mặt lưng máy: Thủy tinh hữu cơKhung máy: Hợp kim,Helio G85,,8,2 GHz,8 GB,6.7 inch,IPS LCD,FHD+,Màn hình chính: 1080 x 2400 Pixels1080 x 2400 Pixels,60 Hz,Điện dung đa điểm,,Mali-G52 MP2,128 GB,Không giới hạn,MicroSD,1 TB,Standard,2.0 MP,8.0 MP,Cảm biến vân tayCảm biến trọng lựcCảm biến tiệm cậnCảm biến gia tốcCảm biến la bànCảm biến ánh sáng,Mật khẩuMở khóa khuôn mặtMở khoá vân tay cạnh viền,Mở rộng bộ nhớ RAMLoa kép,2,2 Nano SIM,4G,Type CCổng sạc: Type CAudio Jack: Jack 3.5 mm,Dual-band (2.4 GHz/ 5 GHz)802.11 a/b/g/n/ac,GPS,v5.3,Jack 3.5 mmOTG,Lithium polymer,5000 mAh,Sạc nhanh 33 W,Android,Android 13.0 (ColorOS 13.1),Sách HDSDỐp lưngQue lấy SIMSạcCáp Type C,IP54,,,,Khoảng 106 GB,HD 720p@30fpsFullHD 1080p@30fps,A.I CameraBan đêm (Night Mode)Nhãn dán (AR Stickers),Quay phim FullHDQuay phim HD,,Kính cường lực Panda,,,Double rear camera,ƒ/2.0,Depth,Single selfie camera,Sạc siêu nhanh SuperVOOC,16 Triệu,"Để nơi khô ráo, nhẹ tay, dễ vỡ.",Xem trong sách hướng dẫn sử dụng,,,,,,,,,,,,,,,
127,Honor 400 5G 12GB 256GB,12.450.000đ,/dien-thoai/honor-400,Trung Quốc,07/2025,24 tháng,156.5 x 7.3 x 74.6 mm,184 g,Khung máy: Kim loạiMặt lưng máy: KínhViền máy: Nhựa,Snapdragon 7 Gen 3,Octa-Core,8,,12 GB,6.55 inch,AMOLED,FHD+,2736 x 1264 Pixels,120 Hz,Điện dung đa điểm,5000 nits,Adreno 720,256 GB,,,,Wide,12.0 MP,50.0 MP,Cảm biến trọng lựcHai cảm biến ánh sáng môi trường xung quanhCảm biến vân tayCảm biến tiệm cậnCảm biến la bàn,Mở khóa khuôn mặtMở khóa vân tay dưới màn hình,,2,"2 Nano SIM hoặc 1 eSIM, 1 Nano SIM",5G,Cổng sạc: Type C,Dual-band (2.4 GHz/ 5 GHz)802.11 a/b/g/n/ac,QZSSGALILEOBEIDOUGLONASSA-GPSGPS,v5.4,NFCOTG,Silicon carbon,6000 mAh,Sạc nhanh 100W,Android,Android 15 (MagicOS 9),Dây cáp sạcCủ sạcỐp lưng,IP66,90%,1 x Cortex A715 2.63 GHz + 3 x Cortex A715 2.4 GHz + 4 x Cortex A510 1.8 GHz,460 ppi,Khoảng 230 GB,4K 30fps FHD1080p@30fps,Ban đêm (Night Mode)Chụp bằng cử chỉChụp nụ cườiBộ lọc màuChế độ chân dungẢnh chuyển động,1080p@30fps,,Kính cường lực,,,Double rear camera,ƒ/2.0,Ultra Wide,Single selfie camera,,1.07 tỷ,,,,,,19.5:9,,,,,,,,,,,
128,iPhone 16e 128GB,16.690.000đ,/dien-thoai/iphone-16e-sim-viettel,Việt Nam / Trung Quốc,02/2025,12 tháng,147.6 x 71.5 x 7.8 mm,167 g,Khung máy: Nhôm nguyên khốiMặt lưng máy: Kính,Apple A18,6 - Core,6,,Đang cập nhật,6.1 inch,OLED,Super Retina XDR,48.0 MP,120,,,Apple GPU 5 nhân,128 GB,Không giới hạn,Không,,,,,Cảm biến khí áp kếCon quay hồi chuyểnCảm biến ánh sángCảm biến gia tốcCảm biến tiệm cận,Mở khóa bằng mật mãMở khóa khuôn mặt,,1,"2 eSim, 1 Nano Sim",5G,1 Type C,Wifi 6,,v5.3,,Lithium-ion,21 Giờ,,iOS,iOS 18,Cáp USB-C to USB-CQue lấy SIMSách HDSD,IP68,,,,,,,,,Phủ Ceramic,,2.000.000:1,Đang cập nhật,,,,Hỗ trợ sạc không dâySạc pin nhanhSạc ngược cho thiết bị khác,,,,,,,,,,,1200 nits,,12.0 MP,,,,,
129,Nubia A56 4GB 128GB,2.490.000đ,/dien-thoai/nubia-a56,Trung Quốc,05/2025,18 tháng,167.64 x 77.37 x 8.3 mm,400 g,Khung viền: NhựaMặt lưng máy: Nhựa,T7200,Octa-Core,8,1.6 GHz,4 GB,6.75 inch,IPS LCD,HD+,720 x 1600 Pixels,90 Hz,Điện dung đa điểm,,ARM Mali G57,128 GB,Không giới hạn,MicroSD,1 TB,Standard,0.08 MP,8.0 MP,Cảm biến la bànCảm biến gia tốcCảm biến tiệm cận,Mật khẩuMở khóa khuôn mặt,,2,2 Nano SIM,4G,Cổng sạc: Type C,802.11 a/b/g/n/ac,GPSA-GPSGALILEOGLONASS,v5.2,,Lithium polymer,5000 mAh,Sạc 10 W,Android,Android 15,SạcCápỐp lưngQue lấy SIMSách HDSD,,,,,,,,,,,,,,,,,,,,,,,,,,,,,,,,,,,
130,Samsung Galaxy S26 Ultra 5G 16GB 1TB,45.990.000đ,/dien-thoai/samsung-galaxy-s26-ultra-16gb,Việt Nam / Trung Quốc,03/2026,12 tháng,163.6 x 78.1 x 7.9 mm,214 g,Khung viền: Armor aluminum,Snapdragon 8 Elite Gen 5,,8,,16 GB,6.9 inch,Dynamic AMOLED 2X,FHD+,3120 x 1440 Pixels,120 Hz,,2600 nits,Đang cập nhật,1 TB,,,,Camera siêu rộng,50.0 MP,12.0 MP,,Mở khóa vân tay dưới màn hìnhMẫu hìnhPINMật khẩuMở khóa khuôn mặt,Thực hiện tác vụ liên ứng dụng bằng lời nóiLọc âm thanhBiên tập Video thông minhKhoanh tròn để tìm kiếmTrợ lý cuộc gọiPhiên dịch viên trực tiếpChọn ảnh chân dung đẹp nhấtTrợ lý Chỉnh ảnhSạc nhanh 45W,2,2 Nano SIM Hoặc 2 eSIM  Hoặc 1 Nano SIM + 1 eSIM,2G5G3G4G,1 Type C,802.11 a/b/g/n,GPSBEIDOUQZSSGLONASSGALILEO,v5.3,NFC,Lithium-ion,5000 mAh,,Android,Android 16,Dây sạcSách HDSDQue lấy SIM,IP68,,,,,UHD 8K (7680 x 4320)@30fps,Lọc âm thanh (Audio Eraser)Sửa tạo sinh (Xóa và tạo ảnh chi tiết bù lại phần bị mất)Chọn ảnh chân dung đẹp nhất (Best Face)Tự tạo bộ lọc,,,Corning Gorilla Glass Victus 2,,,Quad rear camera,,Góc rộng,,Chỉnh sửa ảnh thế hệ mớiKhông gian sáng tạoGợi ý thông minhKhoanh tròn để tìm kiếmLọc cuộc gọi tự độngProscaler & 10-bit mDNIePrivacy Display (Chống nhìn trộm chủ động)Hỗ trợ sạc tối đa 60W,16 Triệu,"Để nơi khô ráo, nhẹ tay, dễ vỡ.",Xem trong sách hướng dẫn sử dụng,,Camera Tele (3x),,,,Có,Camera Tele (5x),,,,,,,,
131,Mobell M139 4G,339.000đ,/dien-thoai/mobell-m139-4g,Trung Quốc,09/2024,12 tháng,113 x 38 x 14 mm,157 g,Mặt lưng máy: Nhựa,,,,,,1.77 inch,TFT LCD,QQVGA,120 x 160 Pixels,,,,,128 MB,,MicroSD,64 GB,,,,,,Ghi âm cuộc gọi,2,2 Nano SIM,4G,,,,,,,1000 mAh,,,,,,,,,,,,,,,,,,,,,,,,,,,,,,,,,,,,,,,
132,Tecno Spark 30 5G 6GB 128GB,3.010.000đ,/dien-thoai/tecno-spark-30,Trung Quốc,03/2025,13 tháng,165.4 x 76.8 x 7.8 mm,188 g,Khung máy: Kim loạiMặt lưng máy: Nhựa,Dimensity 6300 5G,Octa-Core,8,,6 GB,6.67 inch,IPS LCD,HD+,720 x 1600 Pixels,120 Hz,Điện dung đa điểm,480 nits,Mali-G57 MC2,128 GB,,MicroSD,1 TB,Wide,108.0 MP,8.0 MP,Cảm biến vân tayHồng ngoại,Mở khoá vân tay cạnh viền,,2,2 Nano SIM,5G,Cổng sạc: Type C,802.11 a/b/g/n/acDual-band (2.4 GHz/ 5 GHz),GPSGLONASSGALILEOBDS,v5.0,NFC,Lithium polymer,5000 mAh,Sạc nhanh 18 W,Android,Android 14,Dây cáp sạcCủ sạcỐp lưngSách HDSD,IP54,85%,2 x Cortex-A76 2.40 GHz + 6 x Cortex-A55 2.00 GHz,264 ppi,Khoảng 115 GB,,Làm đẹp (Beautify)AI CAMQuay video hiển thị kép,,,Kính cường lực,,,,ƒ/1.9,,,,,,,,,,,,,,,,,,,,,
133,Honor Play 10 3GB 64GB,1.990.000đ,/dien-thoai/honor-play-10,Trung Quốc,2025,18 tháng,16.7 x 7.7 x 0.8 cm,189 g,Đang cập nhật,MediaTek Helio G81,,8,,3 GB,6.74 inch,TFT LCD,Đang cập nhật,720 x 1600 Pixels,,,,,64 GB,,,,,5.0 MP,3.0 MP,,Mẫu hìnhPINMật khẩu,,1,2 Nano SIM,,Type C,802.11 a/b/g/n,,v5.1,,Lithium polymer,5000 mAh,,Android,Đang cập nhật,Củ sạcDây cáp sạcQue lấy SIMSách HDSDỐp lưng,IP52,,,,,FullHD 1080p@240fps,,,,,,,Double rear camera,,,,,,"Để nơi khô ráo, nhẹ tay, dễ vỡ.",Xem trong sách hướng dẫn sử dụng,,,,,,,,,,,,,,,
134,Benco V91c 4GB 128GB,2.590.000đ,/dien-thoai/benco-v91c,Trung Quốc,09/2024,18 tháng,162.9 x 74.7 x 8.9 mm,193 g,Khung máy: Nhựa cao cấp,Unisoc T606,Octa-Core,8,2 GHz,4 GB,6.56 inch,IPS LCD,HD+,720 x 1612 Pixels,90 Hz,Điện dung đa điểm,500 nits,Mali-G57,128 GB,Không giới hạn,MicroSD,,Standard,13.0 MP,8.0 MP,Cảm biến vân tayCảm biến tiệm cậnCảm biến ánh sángCảm biến gia tốcCảm biến la bàn,Mở khóa bằng mật mãMở khóa vân tay,Sạc nhanh 18WSạc nhanh 10W,2,2 Nano SIM,4G,Cổng sạc: Type C,802.11 a/b/g/n/ac,GPSA-GPSGLONASSBEIDOU,v5.0,,Lithium polymer,5000 mAh,,Android,Android 13.0,Củ sạcCáp Type CTai ngheỐp lưngQue lấy SIM,,,,,,,,,,,,,,ƒ/2.2,,Single selfie camera,,,,,,,,,,,,,,,,,,,
135,Honor 400 Lite 5G 12GB 256GB,8.330.000đ,/dien-thoai/honor-400-lite,Trung Quốc,07/2025,24 tháng,161 x 7.29 x 74.55 mm,171 g,Mặt lưng máy: NhựaViền máy: NhựaKhung máy: Kim loại,MediaTek Dimensity 7025-Ultra,Octa-Core,8,,12 GB,6.7 inch,AMOLED,FHD+,1080 x 2412 Pixels,120 Hz,Điện dung đa điểm,3500 nits,,256 GB,,,,Wide,5.0 MP,16.0 MP,Cảm biến trọng lựcHai cảm biến ánh sáng môi trường xung quanhCảm biến la bànCảm biến tiệm cận,Mở khóa vân tay dưới màn hình,,2,2 Nano SIM,5G,Cổng sạc: Type C,802.11 a/b/g/n/acDual-band (2.4 GHz/ 5 GHz)Wi-Fi HotspotWi-Fi Direct,GPSA-GPSGLONASSBEIDOUGALILEO,v5.3,NFCOTG,Lithium-ion,5230 mAh,Sạc nhanh 35 W,Android,Android 15 (MagicOS 9),Dây cáp sạcCủ sạcỐp lưng,IP65,,2 x Cortex A78 2.5 GHz + 6 x Cortex A55 2.0 GHz,393 ppi,Khoảng 230 GB,4K 30fps FHD1080p@30fps,Nhận diện khuôn mặtChế độ chân dungẢnh chuyển độngChụp nụ cườiChụp bằng cử chỉ,1080p@30fps,,Kính cường lực,,,Double rear camera,ƒ/2.1,Ultra Wide,,,16.7 Triệu,,,,,,,,,,,,,,,,,
136,OPPO A3 8GB 256GB,5.680.000đ,/dien-thoai/oppo-a3-8gb,Trung Quốc,08/2024,12 tháng,165.7 x 76 x 7.68 mm,186 g,Khung máy: Nhựa cao cấp,Snapdragon 6s 4G Gen1,Octa-Core,8,2.1 GHz,8 GB,6.67 inch,LCD,HD+,720 x 1600 Pixels,90 Hz,Điện dung đa điểm,1000 nits,Adreno 610,256 GB,Không giới hạn,MicroSD,1 TB,Standard,50 MP,5.0 MP,Cảm biến vân tayCảm biến tiệm cậnCảm biến ánh sángCảm biến gia tốcCảm biến la bàn,Mở khóa bằng mật mãMở khoá vân tay cạnh viềnMật khẩu,,2,2 Nano SIM,4G,Cổng sạc: Type C,802.11 a/b/g/n/ac,GPSGLONASSBEIDOUGALILEOQZSS,v5.0,OTG,Lithium polymer,5100 mAh,Sạc nhanh 45 W,Android,Android 14 (ColorOS 14),Củ sạcCáp Type CỐp lưngSách HDSDQue lấy SIM,IP54,,,,,,,,,Kính cường lực Panda,,,,ƒ/2.2,,,,,,,,,,,,,,,,,,,,,
137,OPPO A18 4GB 128GB,3.190.000đ,/dien-thoai/oppo-a18,Trung Quốc,11/2023,12 tháng,163.74 x 75.03 x 8.16 mm,188 g,Nhựa,Helio G85,,8,2 GHz,4 GB,6.56 inch,LCD,HD+,720 x 1612 Pixels,90 Hz,Điện dung đa điểm,,Mali-G52 MP2,64 GB,,MicroSD,1 TB,Standard,2.0 MP,5.0 MP,Cảm biến vân tayCảm biến tiệm cậnCảm biến ánh sángCảm biến gia tốcCảm biến la bàn,Mở khoá vân tay cạnh viềnMở khóa bằng mật mã,,2,2 Nano SIM,4G,Cổng sạc: Type CAudio Jack: Jack 3.5 mm,802.11 a/b/g/n/acDual-band (2.4 GHz/ 5 GHz),GPS,v5.3,OTG,Lithium polymer,5000 mAh,Sạc nhanh 10 W,Android,Android 13.0 (ColorOS 13.1),SạcCáp Type CQue lấy SIMỐp lưngSách HDSD,IP54,,,,,1080p@30fps720p@30fps,,,,Kính cường lực Panda,,,Double rear camera,ƒ/2.2,Depth,Single selfie camera,,16 Triệu,"Để nơi khô ráo, nhẹ tay, dễ vỡ.",Xem trong sách hướng dẫn sử dụng,,,,,,,,,,,,,,,
